{
  "schema_version": "1.0",
  "receipt_id": "REC-DEMO",
  "benchmark_id": "BENCH-DEMO",
  "code_hash": "6666666666666666666666666666666666666666666666666666666666666666",
  "environment_hash": "3333333333333333333333333333333333333333333333333333333333333333",
  "input_hash": "1111111111111111111111111111111111111111111111111111111111111111",
  "checkpoint_hash": null,
  "parameter_hash": "2222222222222222222222222222222222222222222222222222222222222222",
  "seed": 42,
  "output_hash": "4444444444444444444444444444444444444444444444444444444444444444",
  "status": "PASS_SOFTWARE_FIXTURE",
  "metrics": {
    "theta": 1.0
  },
  "limitations": [
    "Synthetic fixture; not biological validation"
  ],
  "created_at": "2026-10-15T00:00:00Z"
}
